"Id","Code","Name","Address","City","State","Zip","Phone","Email"
"1","59770-JJRUZTPJ-209","Finwe's Understand Client Interior Design","1463 Galighner Terrace","Eldersburg","Maryland","21625",,"interiordesign@finweclient.biz"
"2","GZCBSATV-7783-909330","Celeborn's Release Hospital Optometry","775 Thomas Ln","Manitowoc","Wisconsin","54844","304-553-9106","hospital@celebornhospital.us"
"3","1040-UAIPPLFO-8389","Wormtongue's Hollow Media Dry cleaning","869 Southard Blvd","ERROR",,"20401",,"grace.wormtongue@mediadrycleaning.net"
"4","7218850-UCQZYCNM-7084","Morgoth's Decorate Death Employment Office","1278 Beechmont Trail","West Pensacola","Florida","32501","308-412-0233","employmentoffice@morgothdeath.biz"
"5","67840-KWIIUUV-738","Elros's Serve Information Technology Services","532 Blackrun Boulevard","Butte-Silver Bow (Balance)","Montana","59832","339-487-5222","technologyservices@elrosinformation.com"
"6","479-82870-BPXSA","Beren's Prevent Beer Veterinary Medicine","1670 Coshocton Lane","ERROR","North Dakota","58313","701-585-1718",
"7","6960-CRARGUE-1489","Ori's Insert Wish Crane Chiropractic Office","457 Burnell Boulevard","City of Milford (balance)","Connecticut","6111","319-823-0023","chiropracticoffice@oriwish crane.com"
"8","WVBSCW-4442-4162160","Elwing's Protect Client Medical Transportation","515 Bonaparte Drv","ERROR",,"58372",,
"9","1709-87700-SIMCIC","Feanor's Decorate Reputation Radiology","593 Dresden Street","Southaven","Mississippi","39146",,"radiology@feanorreputation.biz"
"10","1620-KPNGRHH-241","Oakenshield's Void Media Janitorial Services","680 Waters Ridge","Danville","Kentucky","41607","308-038-6845","virginia.oakenshield@mediajanitorialservices.us"
"11","367-8900-SQAEDJXH","Elrond's Exceed Exception Photography","1067 Orders Place","ERROR","Virginia","23409",,
"12","465-6012440-ARHDWD","Finrod's Brainstorm Tennis Casino","1225 Blackwood Avenue","ERROR","Virginia","22315","401-918-8391",
"13","8820-IJXEIS-489","Earendil's Confess People Architecture","1017 Burbank Heights","KÄneâ€˜ohe","Hawaii","96777",,"architecture@earendilpeople.us"
"14","1730-JXGBOLQ-6212","Khamul's Select Hospital Veterinary Medicine","1324 Beauty Ln","Nashua",,"3055","203-122-6664","hospital@khamulhospital.org"
"15","82300-NVGAFIZ-2379","Luthien's Protect Client Collection Agency","1457 Teakwood Place","Muscatine","Iowa","50522","701-829-6125","randy.luthien@collectioncollectionagency21.biz"
"16","8253080-MQOGZIC-5798","Goldberry's Shadow Reality Catering","699 Harbor Ave","ERROR",,"20097","262-551-8479","catering@goldberryreality.net"
"17","LMLFTEG-8414-141930","Durin's Instruct Engine Livestock and Slaughtery","1365 Jewitt Circle","Aurora","Colorado","80215",,"livestockandslaughtery@durinengine.us"
"18","5000-KKJOVYK-2533","Arwen's Collect Permission Vocational Rehabilitation","925 Cornstill Lane","Florence","Kentucky","41274",,"adam.arwen@permissionvocationalrehabilitation67.net"
"19","4834280-EPBMB-867","Butterbur's Void Fortune Collection Agency","508 High Trail","Winona","Minnesota","55161",,"brenda.butterbur@fortunecollectionagency18.org"
"20","779880-AIOTJTJ-581","Quickbeam's Chat Client Security Guard","1337 Candlestick Square","Jeffersontown","Kentucky","42332","231-166-5750","brandon.quickbeam@clientsecurityguard.com"
"21","8771-4410-GKEOKVED","Kementari's Slam Flight Trade School","438 Parliament Ridge","Haines City","Florida","33539","225-245-5968","tradeschool@kementariflight.us"
"22","3626610-NUBJMLJI-936","Shelob's Weaken Disease Catering","914 Locust St","Sheridan","Wyoming","82838","479-539-1175","catering@shelobdisease.us"
"23","ERTQFCLY-7407-740240","Elladan's Test Flight Substance Abuse Services","1289 Dickson Ave","Manchester","New Hampshire","3448","215-048-0137","robert.elladan@flightsubstanceabuseservices.biz"
"24","7640-GYYYWRSN-614","Ferny's Form Desk Investing","1136 Bottom Street","Kaysville",,"84637","385-372-1468","cheryl.ferny@deskinvesting.co.uk"
"25","581-328480-GMXSA","Arwen's Instruct Tennis Barber Shop","616 Wabash Lane","Johnstown","Pennsylvania","19640","480-509-0358","barbershop@arwentennis.co.uk"
"26","4929-83570-UBHHLXHJ","Balin's Convince Information Security Guard","410 Holmes Crescent","Oconomowoc","Wisconsin","53950","423-146-9572",
"27","60230-YSRAF-9905","Gloin's Benefit Philosophy GED Certification","758 Burnet Run","Owasso",,"74335",,"gedcertification@gloinphilosophy.com"
"28","62470-YUCGWJOB-237","Ancalagon's Hurry People Home Health Services","1312 Codell Square","Bridgeport","Connecticut","6506","218-933-2285","ariel.ancalagon@peoplehomehealthservices.net"
"29","7026-8660-AYWKMCTA","Nimrodel's Look Secretary Specialty Fruit","1735 Wentz Ave","Santee",,"95570","209-502-7068",
"30","789-20100-AGXLS","Annatar's Strengthen Bath Trade School","421 Rosewood Ridge","ERROR","West Virginia","24976","203-801-1009",
"31","5890-ZMZYBMES-8915","Alatar's Fancy Handler Gas Distribution","853 Ambarassdor Terrace","ERROR","District of Columbia","20355",,"gasdistribution@alatarhandler.us"
"32","679230-FOOIB-262","Elros's Slammer Opportunity Interior Design","1288 Broad Heights","Artesia","California","90295","302-304-1853",
"33","PUOMOG-944-383850","Fingolfin's Fancy Information Insurance","1705 Shoop St","Salina","Kansas","66948",,
"34","612-318150-YCHWMUVF","Dwalin's Instruct Hospital Repair and Maintenance","1279 Arch Boulevard","Pearl City","Hawaii","96770",,
"35","997-9940-TBUJGF","Brandybuck's Collect Wood Home Health Services","656 Monroe Crescent","Fitchburg","Wisconsin","54495","208-139-3116","homehealthservices@brandybuckwood.biz"
"36","3610-PASKWB-759","Curufin's Seeing Uncle Plumbing","1021 Hewitt Street","Great Falls",,"59226",,
"37","1180-XJTAPPHK-677","Oakenshield's Insert Hospital Janitorial Services","1447 Laurel Rd","Weston","Florida","33233","302-217-9246","angie.oakenshield@hospitalhospital.us"
"38","483-4350-MVSVCVUW","Erestor's Spring Wood Marketing and Advertising","1630 Sevall Ln","Portland","Maine","4988","262-819-7320","richard.erestor@woodmarketingandadvertising3.com"
"39","4981-8568410-BFXRNQTW","Illuvatar's Copy Screener Athletic Training","1232 Carey Blvd","ERROR",,"88121",,"athletictraining@illuvatarscreener.com"
"40","FLXXOAGO-844-2851220","Sharku's Precede Requirement Auto Dealership","1233 Hartford Street","Saco","Maine","4463",,
"41","JGGAJ-760-523730","Gimli's Attach Climate GED Certification","1576 Chapman Square","Terrytown","Louisiana","70892","319-850-2427","gedcertification@gimliclimate.org"
"42","IOTXFBU-778-24290","Varda's Improve Weakness Remodeling","468 Kerri Boulevard","Hannibal","Missouri","64508","225-992-4541","remodeling@vardaweakness.us"
"43","7558170-WKWLHZ-1681","Pollando's Confess Skill Vocational School","1523 Cass Trail","Hickory",,"28358","302-501-8349","vocationalschool@pollandoskill.com"
"44","465-2650-TQVGTT","Elwing's Prevent Response Construction and Utilities","455 Darlington Parkway","â€˜Ewa Gentry","Hawaii","96734",,"constructionandutilities@elwingresponse.us"
"45","694-2211900-EDJBFMC","Yavanna's Look Exception Boring Crop Production","1027 Pennsylvania Avenue","Ocean Springs",,"38720","701-459-3448","liv.yavanna@exceptionboringcropproduction.net"
"46","4520-8590-YOGDBESH","Bifur's Convince User Tax Preparation","1695 Ball Station","Drexel Hill","Pennsylvania","16820",,"taxpreparation@bifuruser.net"
"47","4265670-CEKXED-5817","Nesa's Gasp Screener Dry cleaning","465 Surger Station","Kuna",,"83645","458-009-6025",
"48","8310-VVDUGL-5025","Curufin's Suffer Diamond Fishing and Creature Hunting Murdering","531 Eddy Crescent","ERROR",,"97376",,"fishingandcreaturehuntingmurdering@curufindiamond.net"
"49","6850-CYDJRT-3129","Ulmo's Suffer Engine Security Guard","841 Kahler Lane","Missoula","Montana","59004","239-558-0814","securityguard@ulmoengine.com"
"50","792-818530-FIKBZU","Erestor's Travel Estate Gas Production","507 Fayette Run","Fairborn",,"45761","405-699-0569","melanie.erestor@estategasproduction.biz"
